{
  "schema_version": 1,
  "platform": "TIKTOK",
  "social_account_id": "22222222-2222-4222-8222-222222222222",
  "social_identity_id": "33333333-3333-4333-8333-333333333333",
  "recommended_publish_at": "2026-09-21T15:00:00Z",
  "caption": "Campaign caption",
  "platform_title": null,
  "hashtags": [
    "#ad"
  ],
  "required_mentions": [
    {
      "handle": "@brand",
      "mention_type": "BRAND",
      "instruction": "Mention in caption"
    }
  ],
  "disclosure": {
    "required": true,
    "text": "Paid partnership",
    "instructions": [
      "Keep disclosure visible"
    ],
    "placement": "CAPTION"
  },
  "submission_requirements": {
    "required": true,
    "instructions": [
      "Submit post URL in campaign portal"
    ],
    "submission_url": "https://example.com/submit",
    "required_evidence": [
      "POST_URL"
    ],
    "deadline_at": "2026-09-22T23:59:00Z",
    "provider_disclosure": {
      "required": false,
      "text": null,
      "instructions": []
    }
  },
  "native_audio_recommendation": {
    "schema_version": 1,
    "platform": "TIKTOK",
    "rule_snapshot_id": "11111111-1111-4111-8111-111111111111",
    "not_baked_into_rendered_mp4": true,
    "recommendation_status": "NOT_APPLICABLE",
    "recommendation_type": "NONE",
    "search_terms": [],
    "identifiable_guidance": null,
    "reason": "Campaign does not require native audio.",
    "cue_guidance": [],
    "campaign_compatibility": "NOT_APPLICABLE"
  },
  "required_tags": [],
  "source_attribution": {
    "required": false,
    "text": null,
    "instructions": []
  },
  "posting_restriction_compliance": []
}
