{
  "schema_version": 1,
  "platform": "TIKTOK",
  "social_account_id": "22222222-2222-4222-8222-222222222222",
  "social_identity_id": "33333333-3333-4333-8333-333333333333",
  "recommended_publish_at": null,
  "caption": "Caption",
  "platform_title": null,
  "hashtags": [],
  "required_mentions": [],
  "disclosure": {
    "required": false,
    "text": null,
    "instructions": [],
    "placement": null
  },
  "submission_requirements": {
    "required": false,
    "instructions": [],
    "submission_url": null,
    "required_evidence": [],
    "deadline_at": null,
    "provider_disclosure": {
      "required": false,
      "text": null,
      "instructions": []
    }
  },
  "native_audio_recommendation": {
    "schema_version": 1,
    "platform": "TIKTOK",
    "rule_snapshot_id": "11111111-1111-4111-8111-111111111111",
    "not_baked_into_rendered_mp4": true,
    "recommendation_status": "UNKNOWN",
    "recommendation_type": "NONE",
    "search_terms": [],
    "identifiable_guidance": null,
    "reason": "Campaign audio permission is unverified; do not recommend native audio.",
    "cue_guidance": [],
    "campaign_compatibility": "UNKNOWN"
  },
  "required_tags": [],
  "source_attribution": {
    "required": false,
    "text": null,
    "instructions": []
  },
  "posting_restriction_compliance": []
}
