{
  "schema_version": 1,
  "platform": "TIKTOK",
  "social_account_id": "22222222-2222-4222-8222-222222222222",
  "social_identity_id": "33333333-3333-4333-8333-333333333333",
  "recommended_publish_at": "2026-09-21T15:00:00Z",
  "caption": "Caption",
  "platform_title": null,
  "hashtags": [],
  "required_mentions": [],
  "disclosure": {
    "required": false,
    "text": null,
    "instructions": [],
    "placement": null
  },
  "submission_requirements": {
    "required": false,
    "instructions": [],
    "submission_url": null,
    "required_evidence": [],
    "deadline_at": null,
    "provider_disclosure": {
      "required": false,
      "text": null,
      "instructions": []
    }
  },
  "native_audio_recommendation": {
    "schema_version": 1,
    "platform": "TIKTOK",
    "rule_snapshot_id": "11111111-1111-4111-8111-111111111111",
    "not_baked_into_rendered_mp4": true,
    "recommendation_status": "RECOMMENDED",
    "recommendation_type": "NATIVE_AUDIO_SEARCH",
    "search_terms": [
      "upbeat clean instrumental"
    ],
    "identifiable_guidance": "Choose a currently available clean instrumental matching this search guidance.",
    "reason": "Campaign permits native audio and edit pacing benefits from it.",
    "cue_guidance": [
      {
        "start_ms": 0,
        "end_ms": null,
        "instruction": "Start native audio at post start under dialogue."
      }
    ],
    "campaign_compatibility": "ALLOWED"
  },
  "required_tags": [],
  "source_attribution": {
    "required": false,
    "text": null,
    "instructions": []
  },
  "posting_restriction_compliance": []
}
